{
  "schema": "wcag22",
  "version": 1,
  "as_of": "2026-10",
  "source": "skills/ui-evaluator/references/knowledge/accessibility.md §6 (W3C WCAG 2.2, Recommendation 2024-12-12; ISO/IEC 40500:2025). Criterion names are paraphrased as in that file; SC 4.1.1 is obsolete and omitted.",
  "note": "`coverage` is the last verification method in the row (auto, scripted, judged, human), which the A11Y-20 coverage matrix records; `methods` lists every step. A fail at any step makes the criterion fail.",
  "count": 55,
  "levels": {
    "A": 31,
    "AA": 24
  },
  "criteria": [
    {
      "sc": "1.1.1",
      "level": "A",
      "name": "Non-text content",
      "verification": "auto (image-alt, svg-img-alt, role-img-alt, input-image-alt) + judged (alt is equivalent, or the image is correctly decorative)",
      "methods": [
        "auto",
        "judged"
      ],
      "coverage": "judged",
      "criteria": [
        "A11Y-01"
      ]
    },
    {
      "sc": "1.2.1",
      "level": "A",
      "name": "Audio-only and video-only, prerecorded",
      "verification": "human (transcript or alternative present and accurate)",
      "methods": [
        "human"
      ],
      "coverage": "human",
      "criteria": [
        "A11Y-21"
      ]
    },
    {
      "sc": "1.2.2",
      "level": "A",
      "name": "Captions, prerecorded",
      "verification": "auto (video-caption: a captions track exists) + human (accurate and in sync)",
      "methods": [
        "auto",
        "human"
      ],
      "coverage": "human",
      "criteria": [
        "A11Y-01",
        "A11Y-21"
      ]
    },
    {
      "sc": "1.2.3",
      "level": "A",
      "name": "Audio description or media alternative",
      "verification": "human",
      "methods": [
        "human"
      ],
      "coverage": "human",
      "criteria": [
        "A11Y-21"
      ]
    },
    {
      "sc": "1.2.4",
      "level": "AA",
      "name": "Captions, live",
      "verification": "human",
      "methods": [
        "human"
      ],
      "coverage": "human",
      "criteria": [
        "A11Y-21"
      ]
    },
    {
      "sc": "1.2.5",
      "level": "AA",
      "name": "Audio description, prerecorded",
      "verification": "human",
      "methods": [
        "human"
      ],
      "coverage": "human",
      "criteria": [
        "A11Y-21"
      ]
    },
    {
      "sc": "1.3.1",
      "level": "A",
      "name": "Info and relationships",
      "verification": "auto (list, listitem, th-has-data-cells, aria-required-children) + scripted (forms; ARIA snapshot outline) + judged (visual structure vs ARIA outline)",
      "methods": [
        "auto",
        "scripted",
        "judged"
      ],
      "coverage": "judged",
      "criteria": [
        "A11Y-01",
        "A11Y-13"
      ]
    },
    {
      "sc": "1.3.2",
      "level": "A",
      "name": "Meaningful sequence",
      "verification": "scripted signal (ARIA snapshot order vs visual boxes; CSS order, grid placement) + human",
      "methods": [
        "scripted",
        "human"
      ],
      "coverage": "human",
      "criteria": [
        "A11Y-21"
      ]
    },
    {
      "sc": "1.3.3",
      "level": "A",
      "name": "Sensory characteristics",
      "verification": "judged (copy scanned for shape, position, colour or sound-only instructions) + human",
      "methods": [
        "judged",
        "human"
      ],
      "coverage": "human",
      "criteria": [
        "A11Y-21"
      ]
    },
    {
      "sc": "1.3.4",
      "level": "AA",
      "name": "Orientation",
      "verification": "judged (uie probe at portrait and landscape viewports; no orientation lock)",
      "methods": [
        "judged"
      ],
      "coverage": "judged",
      "criteria": []
    },
    {
      "sc": "1.3.5",
      "level": "AA",
      "name": "Identify input purpose",
      "verification": "auto (autocomplete-valid, for tokens present) + scripted (forms: personal-data fields missing tokens)",
      "methods": [
        "auto",
        "scripted"
      ],
      "coverage": "scripted",
      "criteria": [
        "A11Y-01",
        "A11Y-13"
      ]
    },
    {
      "sc": "1.4.1",
      "level": "A",
      "name": "Use of colour",
      "verification": "auto (link-in-text-block) + scripted (cvd captures) + judged",
      "methods": [
        "auto",
        "scripted",
        "judged"
      ],
      "coverage": "judged",
      "criteria": [
        "A11Y-01",
        "A11Y-19"
      ]
    },
    {
      "sc": "1.4.2",
      "level": "A",
      "name": "Audio control",
      "verification": "auto (no-autoplay-audio)",
      "methods": [
        "auto"
      ],
      "coverage": "auto",
      "criteria": [
        "A11Y-01"
      ]
    },
    {
      "sc": "1.4.3",
      "level": "AA",
      "name": "Contrast, minimum",
      "verification": "auto (color-contrast) + scripted (contrast: composited, pixel-sampled, all states and themes)",
      "methods": [
        "auto",
        "scripted"
      ],
      "coverage": "scripted",
      "criteria": [
        "A11Y-01",
        "A11Y-02",
        "A11Y-11"
      ]
    },
    {
      "sc": "1.4.4",
      "level": "AA",
      "name": "Resize text",
      "verification": "auto (meta-viewport) + scripted (layout: text at 200%)",
      "methods": [
        "auto",
        "scripted"
      ],
      "coverage": "scripted",
      "criteria": [
        "A11Y-01",
        "A11Y-09"
      ]
    },
    {
      "sc": "1.4.5",
      "level": "AA",
      "name": "Images of text",
      "verification": "judged (raster or canvas text in captures)",
      "methods": [
        "judged"
      ],
      "coverage": "judged",
      "criteria": []
    },
    {
      "sc": "1.4.10",
      "level": "AA",
      "name": "Reflow",
      "verification": "scripted (layout at 320 px)",
      "methods": [
        "scripted"
      ],
      "coverage": "scripted",
      "criteria": [
        "A11Y-07"
      ]
    },
    {
      "sc": "1.4.11",
      "level": "AA",
      "name": "Non-text contrast",
      "verification": "scripted (contrast: boundaries, icons, chart marks, focus and state indicators)",
      "methods": [
        "scripted"
      ],
      "coverage": "scripted",
      "criteria": [
        "A11Y-12"
      ]
    },
    {
      "sc": "1.4.12",
      "level": "AA",
      "name": "Text spacing",
      "verification": "scripted (layout: spacing overrides injected)",
      "methods": [
        "scripted"
      ],
      "coverage": "scripted",
      "criteria": [
        "A11Y-08"
      ]
    },
    {
      "sc": "1.4.13",
      "level": "AA",
      "name": "Content on hover or focus",
      "verification": "scripted (uie probe: Esc dismisses without moving the pointer, the pointer can move onto it, it persists) + judged; see CMP-21",
      "methods": [
        "scripted",
        "judged"
      ],
      "coverage": "judged",
      "criteria": []
    },
    {
      "sc": "2.1.1",
      "level": "A",
      "name": "Keyboard",
      "verification": "auto (scrollable-region-focusable, frame-focusable-content) + scripted (keyboard)",
      "methods": [
        "auto",
        "scripted"
      ],
      "coverage": "scripted",
      "criteria": [
        "A11Y-01",
        "A11Y-03"
      ]
    },
    {
      "sc": "2.1.2",
      "level": "A",
      "name": "No keyboard trap",
      "verification": "scripted (keyboard: the walk wraps; Esc leaves modal widgets)",
      "methods": [
        "scripted"
      ],
      "coverage": "scripted",
      "criteria": [
        "A11Y-03",
        "A11Y-06"
      ]
    },
    {
      "sc": "2.1.4",
      "level": "A",
      "name": "Character key shortcuts",
      "verification": "scripted (uie lint) + judged (remap, off switch or focus-only)",
      "methods": [
        "scripted",
        "judged"
      ],
      "coverage": "judged",
      "criteria": [
        "A11Y-17"
      ]
    },
    {
      "sc": "2.2.1",
      "level": "A",
      "name": "Timing adjustable",
      "verification": "auto (meta-refresh) + judged (session timeouts, auto-advancing steps)",
      "methods": [
        "auto",
        "judged"
      ],
      "coverage": "judged",
      "criteria": [
        "A11Y-01"
      ]
    },
    {
      "sc": "2.2.2",
      "level": "A",
      "name": "Pause, stop, hide",
      "verification": "auto (blink, marquee) + scripted (motion: infinite animations) + judged (auto-advance over 5 s without a pause control)",
      "methods": [
        "auto",
        "scripted",
        "judged"
      ],
      "coverage": "judged",
      "criteria": [
        "A11Y-01"
      ]
    },
    {
      "sc": "2.3.1",
      "level": "A",
      "name": "Three flashes or below threshold",
      "verification": "scripted signal (motion: short-period infinite animations) + human (flashes faster than 3 per second, video)",
      "methods": [
        "scripted",
        "human"
      ],
      "coverage": "human",
      "criteria": [
        "A11Y-21"
      ]
    },
    {
      "sc": "2.4.1",
      "level": "A",
      "name": "Bypass blocks",
      "verification": "auto (bypass) + scripted (keyboard: the first stop is a working skip link)",
      "methods": [
        "auto",
        "scripted"
      ],
      "coverage": "scripted",
      "criteria": [
        "A11Y-01"
      ]
    },
    {
      "sc": "2.4.2",
      "level": "A",
      "name": "Page titled",
      "verification": "auto (document-title) + judged (descriptive and unique per route)",
      "methods": [
        "auto",
        "judged"
      ],
      "coverage": "judged",
      "criteria": [
        "A11Y-01"
      ]
    },
    {
      "sc": "2.4.3",
      "level": "A",
      "name": "Focus order",
      "verification": "scripted (keyboard: order vs visual order; dialogs: focus in and back)",
      "methods": [
        "scripted"
      ],
      "coverage": "scripted",
      "criteria": [
        "A11Y-03",
        "A11Y-06"
      ]
    },
    {
      "sc": "2.4.4",
      "level": "A",